{"event_id":"2026-08-03-abtc","as_of":"2026-08-03T06:00:00.105708+00:00","research_complete":true,"research_report":"EVENT AND BASELINES — At the cutoff (02:00 EDT), American Bitcoin had scheduled its Q2 2026 release before the August 3 regular session; the 08:30 EDT/12:30 UTC call is not part of the trigger [S1]. The first complete official release or filing is the only eligible package. Q1 issuer-defined baselines were $62.118m revenue, $29.598m cost of revenue, 52.35% implied mining gross margin, 817 BTC mined, approximately $36,200 cost per BTC, 7,021 BTC held including 3,090 pledged, 663 pre-split satoshis per share, 28.1 EH/s owned and 25.0 EH/s operational after April 22, and 14.1 J/TH operational efficiency [S2][S3]. Cost per BTC excludes depreciation, G&A, financing and capex; owned EH/s is not operational EH/s; gross holdings are not unrestricted liquidity. Adjusted EBITDA does not remove the BTC fair-value loss and therefore is not a clean mining-profit measure. The July 1-for-15 reverse split makes the sequential SPS comparator 9,945, calculated as 663 × 15; approximately 11,100 would only be a scenario assuming the public production yardstick is retained with no intervening sales or denominator changes [S4]. Neither SPS figure is a spillover metric. Management supplied no numerical Q2 guidance.\n\nPUBLIC OPERATING BENCHMARK — Published April, May and June FPPS hashprice averages were $33.92, $36.60 and $30.37 per PH/s/day, with BTC hashprice of 0.00046128, 0.00046887 and 0.00048032 BTC per PH/s/day [S5][S6][S7]. Applying 21.9 EH/s through April 21 and 25.0 EH/s thereafter gives a definition-close but imperfect Q2 yardstick of about $74.4m and 1,040 BTC; assuming 25.0 EH/s for all April gives about $76.6m and 1,070 BTC. Uptime, curtailment, pool fees and realized-price conventions prevent treating this as exact. It establishes that a low/mid-$70m revenue result would largely reflect already-public network economics. Dynamic analyst snapshots disagreed and had split-sensitive EPS definitions, so EPS consensus was not locked.\n\nCAUSAL SCREEN — IREN was the nearest operating analogue but failed the trade gate. ABTC's ASICs are exclusively hosted at Hut 8 with pass-through costs and ABTC retains BTC; IREN owns its infrastructure, generally liquidates mined BTC and is actively displacing mining capacity for AI Cloud. Its March quarter already contained $111.2m mining revenue, $33.6m AI Cloud revenue and substantial mining-equipment impairment [S8]. ABTC cannot reveal IREN-specific power prices, curtailment, ASIC removals or AI deployment, while shared BTC/hashprice inputs were already public. MSTR failed because Strategy's value transmission is BTC price, financing, preferred obligations and BTC per diluted share—not mining economics—and it had disclosed 846,000 BTC at June 30 versus ABTC's 7,021 at March 31 [S9]. COIN failed because ABTC discloses no material trading-volume, custody-fee, USDC, derivatives or payments linkage, and Coinbase's own Q2 disclosure was scheduled four days earlier [S10]. Same-direction movement would therefore be common crypto-factor correlation, not evidence that ABTC caused candidate cash-flow revisions.\n\nPRICE-IMPACT CALIBRATION — No candidate survived, so no directional percentage or no-action band was fabricated. The exact MSTRUSDT and COINUSDT Binance equity perpetuals launched only in February 2026 and trade 24/7 [S11]; IRENUSDT launched June 3, after IREN's latest earnings [S12]. No exact candidate instrument had a qualifying candidate-own BMO earnings sample sufficient to estimate separate upside, downside and ordinary in-line distributions. Context only: using Nasdaq underlying-equity closes, IREN moved from $48.65 to $46.37 (-4.7%) on November 14, 2025 after ABTC reported a broadly positive Q3 package, and from $44.03 to $44.24 (+0.5%) on February 26, 2026 after another positive Q4 package [S13][S14][S15]. These observations were excluded from calibration because they predate the exact IRENUSDT contract, number only two, have the same positive issuer direction but opposite candidate signs, and are contaminated by BTC/macro and concurrent earnings. ABTC's May 6, 2026 package was also excluded because its SEC acceptance at 16:20:18 EDT made it AMC, not BMO [S3]. Substituting underlying equity, AMC events or generic volatility would violate the required candidate-own BMO calibration.\n\nDEBATE ADJUDICATION — The financial analyst initially proposed retaining IREN conditionally; the industry analyst and impact critic rejected it on model mismatch, pre-observed common inputs and absent exact-instrument calibration. After receiving the same conflict packet, the financial analyst revised to rejection and withdrew all proposed percentage gates. All three ultimately rejected IREN, MSTR and COIN and agreed that six directional tiers could not honestly be locked. The empty candidate list is therefore an affirmative no-trade conclusion, not a fallback caused by a strong condition failing. All ranked ledger questions are resolved: the package definitions and public operating yardstick are locked, every proposed transmission path was tested, and insufficient calibration caused candidate removal as required.","analysis_brief":"### Fields to extract\n\nNone.\n\n### Classification\n\nImpossible by construction: no instrument survived both the causal-transmission and exact-instrument BMO calibration gates. Do not calculate an event score or select an outcome.","trade_candidates":[],"sources":[{"id":"S1","title":"American Bitcoin Schedules Second Quarter 2026 Earnings Release and Conference Call","url":"https://www.abtc.com/news-and-insights/american-bitcoin-schedules-second-quarter-2026-earnings-release-and-conference-call","published_at":"2026-07-10T07:30:00-04:00"},{"id":"S2","title":"American Bitcoin Form 10-Q for the quarter ended March 31, 2026","url":"https://www.sec.gov/Archives/edgar/data/1755953/000119312526209008/abtc-20260331.htm","published_at":"2026-05-06T16:15:48-04:00"},{"id":"S3","title":"American Bitcoin Reports First Quarter 2026 Results","url":"https://www.sec.gov/Archives/edgar/data/1755953/000119312526209054/abtc-ex99_1.htm","published_at":"2026-05-06T16:20:18-04:00"},{"id":"S4","title":"American Bitcoin Reverse Stock Split Form 8-K","url":"https://www.sec.gov/Archives/edgar/data/1755953/000119312526296396/abtc-20260702.htm","published_at":"2026-07-06"},{"id":"S5","title":"Luxor Hashrate Lookback Series — April 2026","url":"https://hashrateindex.com/blog/luxor-hashrate-lookback-series-april-2026/","published_at":"2026-05-08"},{"id":"S6","title":"Luxor Hashrate Lookback Series — May 2026","url":"https://hashrateindex.com/blog/luxor-hashrate-lookback-series-may-2026/","published_at":"2026-06-05"},{"id":"S7","title":"Luxor Hashrate Lookback Series — June 2026","url":"https://hashrateindex.com/blog/luxor-hashrate-lookback-series-may-2026-2/","published_at":"2026-07-10"},{"id":"S8","title":"IREN Form 10-Q for the quarter ended March 31, 2026","url":"https://www.sec.gov/Archives/edgar/data/1878848/000187884826000026/iren-20260331.htm","published_at":"2026-05-07"},{"id":"S9","title":"Strategy Bitcoin Holdings Update as of June 30, 2026","url":"https://www.sec.gov/Archives/edgar/data/1050446/000119312526295586/mstr-20260706.htm","published_at":"2026-07-06"},{"id":"S10","title":"Coinbase Announces Date of Second Quarter 2026 Financial Results","url":"https://investor.coinbase.com/news/news-details/2026/Coinbase-Announces-Date-of-Second-Quarter-2026-Financial-Results/default.aspx","published_at":"2026-07-15"},{"id":"S11","title":"How to Trade Stock Perpetual Contracts on Binance","url":"https://academy.binance.com/ur-PK/articles/how-to-trade-stock-perpetual-contracts-on-binance","published_at":"2026-04-23"},{"id":"S12","title":"Binance to List Perpetual Contracts for DELL, IBM, NOW, CRM, IREN and ONDS","url":"https://www.techflowpost.com/en-US/newsletter/124394","published_at":"2026-06-03"},{"id":"S13","title":"American Bitcoin Reports Third Quarter 2025 Results","url":"https://www.sec.gov/Archives/edgar/data/1755953/000119312525281406/abtc-ex99_1.htm","published_at":"2025-11-14T06:40:26-05:00"},{"id":"S14","title":"American Bitcoin Reports Fourth Quarter and Full Year 2025 Results","url":"https://www.sec.gov/Archives/edgar/data/1755953/000119312526073305/abtc-ex99_1.htm","published_at":"2026-02-26T06:35:26-05:00"},{"id":"S15","title":"IREN Historical Stock Prices","url":"https://www.nasdaq.com/market-activity/stocks/iren/historical","published_at":null}]}